Gassaway1905_TTT,newspaper-article,"[Frank Gassaway],","""Story of a Woman Crusoe,""",Story of a Woman Crusoe,<i>Alexandria (IN) Times-Tribune</i>,"5,",no. 291,7,August,1905,1905-08-07,"Daily Ed., 3",,,,,"Alexandria, Indiana",Public domain,,,,,,,
GenevaDailyTimes1921,newspaper-article,,"""Alone for Eighteen Years. Indian Woman, Abandoned on Desert Island, Finally Found by Party of Otter Hunters,"" ","Alone for Eighteen Years. Indian Woman, Abandoned on Desert Island, Finally Found by Party of Otter Hunters",<i>Geneva (NY) Daily Times</i>,"27, ",no. 49,26,July,1921,1921-07-26,7,,,,,"Geneva, New York",Public domain,,,,,,,
GFM1881,newspaper-article,"G. F. M.,","""An Earthly Paradise. A Stranger's View of Santa Barbara, and Her Surroundings,""","Earthly Paradise. A Strangers View of Santa Barbara, and Her Surroundings",<i>Santa Barbara (CA) Daily Press</i>,"9, ",no. 162,13,April,1881,1881-04-13,4,,,,,"Santa Barbara, California",Public domain,,,,,,,
Goliah1853_DPT,newspaper-article,"Goliah,","""A Female Robinson Crusoe,""",Female Robinson Crusoe,<i>San Francisco Daily Placer Times and Transcript</i>,"5,",no. 1075,23,September,1853,1853-09-23,2,G.K. Fitch,,,,"San Francisco, California",Public domain,,,,,,,
Goliah1853_NYDT,newspaper-article,"Goliah, ","""A Female Robinson Crusoe,""",Female Robinson Crusoe,<i>New-York Daily Times</i>,"3,",no. 659,28,October,1853,1853-10-28,2,,,,,"New York, New York",Public domain,,,,,,,
GreenburghRegister1893_Aug11,newspaper-article,,"No title,","No title,",<i>Greenburgh (NY) Register</i>,"14, ",no. 6,11,August,1893,1893-08-11,6,,,,,"Dobbs' Ferry, New York",Public domain,,,,,,,
GreenburghRegister1893_Aug25,newspaper-article,"[Edwards Roberts],","""A Female Crusoe,"" ",Female Crusoe ,<i>Greenburgh (NY) Register</i>,"14, ",no. 8,25,August,1893,1893-08-25,3,,,,,"Dobbs' Ferry, New York",Public domain,,,,,,,
Hardacre1880_TBC,newspaper-article,"[Emma C. Hardacre],","""Eighteen Years Alone: A Tale of the Pacific,""",Eighteen Years Alone A Tale of the Pacific,<i>Brookfield (NY) Courier</i>,"5,",no. 19,1,September,1880,1880-09-01,1,Stillman & Spooner,,,,"Brookfield, New York",Public domain,,,,,,,
Hardacre1880_TH,newspaper-article,"[Emma C. Hardacre],","""Eighteen Years Alone. A Tale of the Pacific,"" ",Eighteen Years Alone. A Tale of the Pacific,<i>St. Joseph (MI) Traveler-Herald</i>,,,18,September,1880,1880-09-18,,,,,,"Saint Joseph, Michigan",Public domain,,,,,,,
Hardacre1880_THR,newspaper-article,"[Emma C. Hardacre],","""Eighteen Years Alone. A Tale of the Pacific,""",Eighteen Years Alone. A Tale of the Pacific,<i>Holton (KS) Recorder</i>,"13, ",no. 25,16,September,1880,1880-09-16,3,,,,,"Holton, Kansas",Public domain,,,,,,,
Hardacre1880_TTDT,newspaper-article,"[Emma C. Hardacre],","""Eighteen Years Alone. A Tale of the Pacific,"" ",Eighteen Years Alone. A Tale of the Pacific,<i>Troy (NY) Daily Times</i>,"30, ",no. 67,11,September,1880,1880-09-11,4,,,,,"Troy, New York",Public domain,,,,,,,
Hardacre1880_VP,newspaper-article,"Emma C. Hardacre,","""Eighteen Years Alone. A Tale of the Pacific,"" ",Eighteen Years Alone. A Tale of the Pacific,<i>Vermont Phoenix</i>,"47, ",no. 37,10,September,1880,1880-09-10,1,,,,,"Brattleboro, Vermont",Public domain,,,,,,,
Hardacre1880_WE,newspaper-article,"[Emma C. Hardacre],","""Eighteen Years Alone. A Tale of the Pacific,""",Eighteen Years Alone. A Tale of the Pacific,"<i>Watkins (Watkins Glen, NY) Express</i>","27,",no. 16,2,September,1880,1880-09-02,1,Levi M. Gano,,,,"Watkins Glen, New York",Public domain,,,,,,,
Hardacre1881_ODH16(92),newspaper-article,"[Emma C. Hardacre],","""Eighteen Years Alone. A Tale of the Pacific,"" ",Eighteen Years Alone. A Tale of the Pacific,<i>Omaha (NE) Daily Herald</i>,"16, ",no. 92,25,January,1881,1881-01-25,6,,,,,"Omaha, Nebraska",Public domain,,,,,,,
Hardacre1881_ODH16(93),newspaper-article,"[Emma C. Hardacre],","""Eighteen Years Alone,""",Eighteen Years Alone,<i>Omaha (NE) Daily Herald</i>,"16, ",no. 93,26,January,1881,1881-01-26,3,,,,,"Omaha, Nebraska",Public domain,,,,,,,
HeraldAndTribune1885,newspaper-article,"[Fred Spalding Witter],","""A Feminine Crusoe. Eighteen Years on a Desert Island,""",Feminine Crusoe. Eighteen Years on a Desert Island,<i>Jonesborough (TN) Herald and Tribune</i>,"16,",no. 14,28,May,1885,1885-05-28,1,Herald and Tribune,,,,"Jonesborough, Tennessee",Public domain,,,,,,,
HolmesCountyRepublican1857,newspaper-article,"C. J. W. Russell,","""Selected Tale. A California Crusoe. Narrative of a Woman Who Lived Eighteen Years Alone Upon the Island of San Nicolas,""",Selected Tale. A California Crusoe. Narrative of a Woman Who Lived Eighteen Years Alone Upon the Island of San Nicolas,<i>Holmes County (OH) Republican</i>,1,no. 37,7,May,1857,1857-05-07,1,,,,,"Millersburg, Ohio",,,,,,,,
LipscombLimeLight1921,newspaper-article,,"""Alone for Eighteen Years. Indian Woman, Abandoned on Desert Island, Finally Found by Party of Otter Hunters,"" ","Alone for Eighteen Years. Indian Woman, Abandoned on Desert Island, Finally Found by Party of Otter Hunters",<i>Lipscomb (TX) Lime Light and Follett (TX) Times</i>,"4, ",no. 42,1,December,1921,1921-12-01,3,,,,,"Follett, Texas",Public domain,,,,,,,
LongIslander1848,newspaper-article,,"""A Female Crusoe,""",Female Crusoe,"<i>Long-Islander</i> (Huntington, NY)","9, ",no. 24,21,January,1848,1848-01-21,1,,,,,"Huntington, New York",Public domain,,,,,,,
LosAngelesHerald1891,newspaper-article,,"""A Ghastly Spot. San Nicolas Island Covered with Human Bones. Thousands of Skeletons Strewn on the Beach for a Distance of Five Miles. An Old Indian Graveyard,"" ",Ghastly Spot. San Nicolas Island Covered with Human Bones. Thousands of Skeletons Strewn on the Beach for a Distance of Five Miles. An Old Indian Graveyard ,<i>Los Angeles Herald</i>,"36, ",no. 134,31,August,1891,1891-08-31,7,,,,,"Los Angeles, California",Public domain,,,,,,,
LosAngelesHerald1898,newspaper-article,,"""Catalina Chatter. The Summer Season's Premature End. Duyckinck's Thousand Fish,""",Catalina Chatter. The Summer Seasons Premature End. Duyckincks Thousand Fish,<i>Los Angeles Herald</i>,"25,",no. 355,20,September,1898,1898-09-20,9,Ayers & Lynch,,,,"Los Angeles, California",Public domain,,,,,,,
LosAngelesTimes1898,newspaper-article,,"""Santa Catalina Island. Money Raised for an Addition to the Church—Good Goat Hunt,""",Santa Catalina Island. Money Raised for an Addition to the Church—Good Goat Hunt,<i>Los Angeles Times</i>,"17,",,18,September,1898,1898-09-18,"Sunday edition, 15",,,,,"Los Angeles, California",Public domain,,Copyright 1961. Los Angeles Times. Reprinted with Permission.,Copyright 1961. Los Angeles Times. Reprinted with Permission.,,,,
LosAngelesTimes1928,newspaper-article,,"""Story of Lost Woman Retold. Legend of San Nicolas Island Revived in Ceremony. Plaque Placed in Grounds of Santa Barbara Mission. Church and Laity Combine in Paying Late Tribute,""",Story of Lost Woman Retold. Legend of San Nicolas Island Revived in Ceremony. Plaque Placed in Grounds of Santa Barbara Mission. Church and Laity Combine in Paying Late Tribute,<i>Los Angeles Times</i>,"47,",,28,February,1928,1928-02-28,"Pt. 2, pp. 14",,,,,"Los Angeles, California",Public domain,,Copyright 1961. Los Angeles Times. Reprinted with Permission.,Copyright 1961. Los Angeles Times. Reprinted with Permission.,,,,
LosAngelesTimes1929,newspaper-article,,"""Fish-Hook Has Sad History: Crude Instrument Loaned to Santa Barbara Museum for Years Used by Lone Woman Crusoe,""",Fish-Hook Has Sad History Crude Instrument Loaned to Santa Barbara Museum for Years Used by Lone Woman Crusoe,<i>Los Angeles Times</i>,"49, ",,28,December,1929,1929-12-28,9,,,,,"Los Angeles, California",Y,pd,Copyright 1961. Los Angeles Times. Reprinted with Permission.,Copyright 1961. Los Angeles Times. Reprinted with Permission.,,,,
LowellDailyCitizen1879,newspaper-article,,"""A Female Crusoe—A Strange Tale From the Pacific Ocean,""",Female Crusoe—A Strange Tale From the Pacific Ocean,<i>Lowell (MA) Daily Citizen and News</i>,"29, ",no. 7098,21,March,1879,1879-03-21,1,,,,,"Lowell, Massachusetts",Public domain,,,,,,,
LowellDailyCitizenAndNews1857,newspaper-article,"C. J. W. Russell,","""A California Crusoe,""",California Crusoe,<i>Lowell (MA) Daily Citizen and News</i>,"6, ",no. 296,13,April,1857,1857-04-13,1-2,,,,,"Lowell, Massachusetts",Public domain,,,,,,,
Lyttle1908,newspaper-article,"G. Brittain Lyttle,","""Education as a Leading Factor in Human Life,""",Education as a Leading Factor in Human Life,<i>Barbourville (KY) Mountain Advocate</i>,"5,",no. 36,16,October,1908,1908-10-16,1,Daniel William Clark,,,,"Barbourville, Kentucky",Public domain,,,,,,,
MadisonCountyTimes1885,newspaper-article,"[Fred Spalding Witter],","""Crusoe in Petticoats. A Woman Who was Eighteen Years on a Desert Island,""",Crusoe in Petticoats. A Woman Who was Eighteen Years on a Desert Island,<i>Madison County (NY) Times</i>,"15, ",no. 48,26,June,1885,1885-06-26,1,,,,,"Chittenango, New York",Public domain,,,,,,,
MaryboroughChronicle1897,newspaper-article,,"""The Islands of Mystery. Remains of a Giant Race,""",Islands of Mystery. Remains of a Giant Race,"<i>Maryborouogh (AUS) Chronicle, Wide Bay and Burnett Advertiser</i>",,no. 7608,25,March,1897,1897-03-25,3,,,,,"Maryborough, Queensland, Australia",,,,"Australian periodicals published in this archive were found via the National Library of Australia’s Trove project: http://trove.nla.gov.au. If re-publishing, quoting from, or reproducing images from this digital archive with original publication in Australia, we request that you cite the original source provided via Trove, as well as the Lone Woman and Last Indians Digital Archive (Lone Woman and Last Indians Digital Archive, University of South Carolina, https://www.nps.gov/subjects/islandofthebluedolphins/index.htm). Information about Australia copyright law, including fair use, can be found here: http://www.nla.gov.au/copyright-in-library- collections. 

Responsibility for any use of the contents of the Lone Woman and Last Indians Digital Archive rests exclusively with the user.",,,,
MEDudley1901_TCN_Nov8,newspaper-article,"[M. E. Dudley],","""The Woman of San Nicolas Island. A Strange Story of the Pacific Coast,"" ",Woman of San Nicolas Island. A Strange Story of the Pacific Coast,<i>Canonsburg (PA) Notes</i>,"8,",no. 2343,8,November,1901,1901-11-08,2,,,,,"Canonsburg, Pennsylvania",Public domain,,,,,,,
MEDudley1901_TCN_Nov9,newspaper-article,"[M. E. Dudley],","""The Woman of San Nicolas Island. A Strange Story of the Pacific Coast,"" ",Woman of San Nicolas Island. A Strange Story of the Pacific Coast,<i>Canonsburg (PA) Notes</i>,"8,",no. 2343,9,November,1901,1901-11-09,2,,,,,"Canonsburg, Pennsylvania",Public domain,,,,,,,
MEDudley1901_TEJ,newspaper-article,"[M. E. Dudley], ","""Was A Hermit Twenty Years. Alone On San Nicolas Island. The Woman When Discovered had Formulated a Strange but Fluent Language,"" ",Was A Hermit Twenty Years. Alone On San Nicolas Island. The Woman When Discovered had Formulated a Strange but Fluent Language,<i>Ottawa (CAN) Evening Journal</i>,"16,",no. 53,21,September,1901,1901-09-21,10,,,,,"Ottawa, Ontario, Canada",Public domain,,,"Under most circumstances, materials published in France, Germany, or Russia enter the public domain 70 years after the death of their author, and material published in Canada 50 after the death of their author. If re-publishing, quoting from, or reproducing images from this digital archive with original publication in France, Germany, Russia, or Canada, we request that you cite it as follows: Lone Woman and Last Indians Digital Archive, University of South Carolina, https://www.nps.gov/books/island-of-the-blue-dolphins/index.htm. 

Responsibility for any use of the contents of the Lone Woman and Last Indians Digital Archive rests exclusively with the user.",,,,
MEDudley1901_TNR,newspaper-article,"[M. E. Dudley],","""The Woman of San Nicolas Island. A Strange Story of the Pacific Coast,"" ",Woman of San Nicolas Island. A Strange Story of the Pacific Coast,<i>Littleton (NC) News Reporter</i>,"7, ",no. 5,22,November,1901,1901-11-22,3,,,,,"Littleton, North Carolina",Public domain,,,,,,,
MEDudley1901_TSC,newspaper-article,"[M. E. Dudley],","""The Woman of San Nicolas Island. A Strange Story of the Pacific Coast,"" ",Woman of San Nicolas Island. A Strange Story of the Pacific Coast,<i>Washington (DC) Suburban Citizen</i>,"13, ",no. 41,2,November,1901,1901-11-02,3,,,,,"Washington, DC",Public domain,,,,,,,
MexicoWeeklyLedger1887,newspaper-article,,"""A Mountain Mystery,""",Mountain Mystery,<i>Mexico (MO) Weekly Ledger</i>,28,no. 45,17,February,1887,1887-02-17,4,,,,,"Mexico, Missouri",,,,,,,,
MorningOregonian1897,newspaper-article,,"""Islands of Skulls. In the Pacific Ocean That Are Veritable Golgothas. Not Far from the Pacific Coast, and a Scientific Party Is Now Exploring Them,""","Islands of Skulls. In the Pacific Ocean That Are Veritable Golgothas. Not Far from the Pacific Coast, and a Scientific Party Is Now Exploring Them",<i>Morning Oregonian</i> (Portland),"36, ",no. 11797,23,July,1897,1897-07-23,7,,,,,"Portland, Oregon",Public domain,,,,,,,
MorningTribune1896,newspaper-article,,"""The Channel Islands. An Expedition Now Making a Thorough Explanation of Them. The Mystery of the Group. Lost Woman of San Nicolas the Last of Her Race—Skeletons of Giants Whose History Is as Yet Unknown. The Golgotha in the Pacific,"" ",Channel Islands. An Expedition Now Making a Thorough Explanation of Them. The Mystery of the Group. Lost Woman of San Nicolas the Last of Her Race—Skeletons of Giants Whose History Is as Yet Unknown. The Golgotha in the Pacific ,<i>Altoona (PA) Morning Tribune</i>,"22, ",no. 178,7,October,1896,1896-10-07,2,,,,,"Altoona, Pennsylvania",Public domain,,,,,,,
MorningTribune1913,newspaper-article,,"""An Island Mystery,"" ",Island Mystery ,<i>Altoona (PA) Morning Tribune</i>,,,2,January,1913,1913-01-02,8,,,,,"Altoona, Pennsylvania",Public domain,,,,,,,
MorningWorldHerald1896,newspaper-article,,"""San Nicolas' Last Woman. Feminine Robinson Crusoe Who Lived Alone More Than Seventeen Years. Deserted Island in the Pacific Long the Home of a Solitary Indian. History of the Removal of a Tribe and the Neglect of Its One Member,""",San Nicolas Last Woman. Feminine Robinson Crusoe Who Lived Alone More Than Seventeen Years. Deserted Island in the Pacific Long the Home of a Solitary Indian. History of the Removal of a Tribe and the Neglect of Its One Member,<i>Omaha (NE) Morning World-Herald</i>,"32, ",no. 53,22,November,1896,1896-11-22,7,,,,,"Omaha, Nebraska",Public domain,,,,,,,
MountCarmelItem1921,newspaper-article,,"""Alone For Eighteen Years. Indian Woman, Abandoned on Desert Island, Finally Found by Party of Otter Hunters,"" ","Alone For Eighteen Years. Indian Woman, Abandoned on Desert Island, Finally Found by Party of Otter Hunters",<i>Mount Carmel (PA) Item</i>,"33, ",no. 209,7,July,1921,1921-07-07,3,,,,,"Mount Carmel, Pennsylvania",Public domain,,,,,,,
NewBedfordMercury1847,newspaper-article,,"""A Female Crusoe,"" ",Female Crusoe ,<i>New-Bedford (MA) Mercury</i>,"40, ",no. 4,15,January,1847,1847-01-15,4,,,,,"Bedford, Massachusetts",Public domain,,,,,,,
NewHampshireSentinel1885,newspaper-article,"[Fred Spalding Witter],","""A Feminine Crusoe. Eighteen Years Alone on a Desert Seventy Miles from Shore,""",Feminine Crusoe. Eighteen Years Alone on a Desert Seventy Miles from Shore,<i>New Hampshire Sentinel</i>,"87, ",no. 23,10,June,1885,1885-06-10,1,,,,,"Keene, New Hampshire",Public domain,,,,,,,
NewOrleansDailyCrescent1857,newspaper-article,"C. J. W. Russell,","""A California Crusoe. Narrative of a Woman Who Lived Eighteen Years Alone on San Nicolas Island,""",California Crusoe. Narrative of a Woman Who Lived Eighteen Years Alone on San Nicolas Island,<i>New Orleans (LA) Daily Crescent</i>,9,no. 279,26,January,1857,1857-01-26,6,,,,,"New Orleans, Louisiana",,,,,,,,
NewsAndCitizen1885,newspaper-article,"[Fred Spalding Witter],","""A Female Crusoe. The Singular Story of the Lost Woman of San Nicolas. Found on an Island Where She had Remained for Sixteen Years,""",Female Crusoe. The Singular Story of the Lost Woman of San Nicolas. Found on an Island Where She had Remained for Sixteen Years,<i>Morrisville and Hyde Park (VT) News and Citizen</i>,13,no. 15,25,June,1885,1885-06-25,1,,,,,"Morrisville, Vermont",,,,,,,,
NewYorkDailyTribune1847,newspaper-article,,"""A Female Crusoe,""",Female Crusoe,<i>New York Daily Tribune</i>,"6,",no. 243,18,January,1847,1847-01-18,4,Greeley & McElrath,,,,"New York, New York",Public domain,,,,,,,
NewYorkDailyTribune1893,newspaper-article,,"""Personal,"" ",Personal,<i>New York Daily Tribune</i>,"53, ",no. 17048,19,July,1893,1893-07-19,6,,,,,"New York, New York",Public domain,,,,,,,
NewYorkEveningExpress1847,newspaper-article,,"""A Female Crusoe,""",Female Crusoe,<i>New York Evening Express</i>,,,8,January,1847,1847-01-08,2-3,,,,,"New York, New York",Public domain,,,,,,,
NewYorkHerald1879,newspaper-article,"[Absalom B. Stuart],","""A Female Crusoe. An Indian Woman Eighteen Years on San Nicolas Island—How She Lived, Was Rescued and Died,""","Female Crusoe. An Indian Woman Eighteen Years on San Nicolas Island—How She Lived, Was Rescued and Died",<i>New York Herald</i>,,,14,February,1879,1879-02-14,2,,,,,"New York, New York",Public domain,,,,,,,
NewYorkTimes1879,newspaper-article,,"No title,","No title,",<i>New York Times</i>,,,3,March,1879,1879-03-03,4,,,,,"New York, New York",Public domain,,,,,,,
NewYorkTimes1895,newspaper-article,,"""On an Isle of Skulls. Once the Home of a Vigorous Race of Indians. Filled with Scientific Treasures. The Last Survivor on the Channel Islands, Off the California Coast, Has Now Been Dead over Forty Years,""","On an Isle of Skulls. Once the Home of a Vigorous Race of Indians. Filled with Scientific Treasures. The Last Survivor on the Channel Islands, Off the California Coast, Has Now Been Dead over Forty Years",<i>New York Times</i>,,,1,December,1895,1895-12-01,29,,,,,"New York, New York",Public domain,,,,,,,
OswegoTimesExpress1885,newspaper-article,"[Fred Spalding Witter],","""A Feminine Crusoe. How She Lived Eighteen Years on a Desert Island. The Story of the Lost Woman of San Nicolas—Her Ingenuity and Fertility of Invention—A Wonderful History,""",Feminine Crusoe. How She Lived Eighteen Years on a Desert Island. The Story of the Lost Woman of San Nicolas—Her Ingenuity and Fertility of Invention—A Wonderful History,<i>Oswego (NY) Times-Express</i>,"42, ",no. 117,18,June,1885,1885-06-18,2,,,,,"Oswego, New York",Public domain,,,,,,,
OxnardDailyCourier1928,newspaper-article,,"""D. A. R. Luncheon,""",D. A. R. Luncheon,<i>Oxnard (CA) Daily Courier</i>,"21, ",no. 195,21,February,1928,1928-02-21,3,,,,,"Oxnard, California","Defunct (http://chroniclingamerica.loc.gov/lccn/sn93053223/)

email Sara-->Rachel 2 Oct 2014",,,,,,,
Paul1897,newspaper-article,"Oliver M. Paul, ","""A Female Robinson Crusoe. A Romance of Truth from the Santa Barbara Islands,""",Female Robinson Crusoe. A Romance of Truth from the Santa Barbara Islands,<i>Los Angeles Herald</i>,"26,",no. 144,21,February,1897,1897-02-21,18,Ayers & Lynch,,,,"Los Angeles, California",Public domain,,,,,,,
PlantersBanner1853,newspaper-article,,"""A Female Crusoe,"" ",Female Crusoe ,<i>Franklin (LA) Planters' Banner</i>,,,17,November,1853,1853-11-17,2,,,,,"Franklin, Louisiana",Public domain,,,,,,,
PublicLedger1847,newspaper-article,,"""A Female Crusoe,"" ",Female Crusoe ,<i>Philadelphia Public Ledger</i>,"22,",no. 98,16,January,1847,1847-01-16,1,,,,,"Philadelphia, Pennsylvania",Public domain,,,,,,,
Rawlins1881_Jul27,newspaper-article,"J. H. Rawlins,","""The Heroine of San Nicholas. A Woman's Life for Eighteen Years on a Desert Island. A Modern Fact More Marvellous Than the Time-Honored Fiction of Robinson Crusoe,"" ",Heroine of San Nicholas. A Womans Life for Eighteen Years on a Desert Island. A Modern Fact More Marvellous Than the Time-Honored Fiction of Robinson Crusoe ,<i>Santa Barbara (CA) Daily Press</i>,"9, ",no. 263,27,July,1881,1881-07-27,6,,,,,"Santa Barbara, California",Public domain,,,,,,,
Rawlins1881_Nov17,newspaper-article,"J. H. Rawlins,","""The Heroine of San Nicholas. A Woman's Life for Eighteen Years on a Desert Island. A Modern Fact More Marvellous Than the Time-Honored Fiction of Robinson Crusoe,"" ",Heroine of San Nicholas. A Womans Life for Eighteen Years on a Desert Island. A Modern Fact More Marvellous Than the Time-Honored Fiction of Robinson Crusoe ,<i>Santa Barbara (CA) Daily Press</i>,"10, ",no. 41,17,November,1881,1881-11-17,6,,,,,"Santa Barbara, California",Public domain,,,,,,,
ReadingTimes1885,newspaper-article,"[Fred Spalding Witter],","""A Feminine Crusoe. How She Lived Eighteen Years on a Desert Island. The Story of the Lost Woman of San Nicolas—Her Ingenuity and Fertility of Invention—A Wonderful History,""",Feminine Crusoe. How She Lived Eighteen Years on a Desert Island. The Story of the Lost Woman of San Nicolas—Her Ingenuity and Fertility of Invention—A Wonderful History,<i>Reading (PA) Times</i>,"56, ",no. 103,1,August,1885,1885-08-01,3,,,,,"Reading, Pennsylvania",Public domain,,,,,,,
ReadingTimesAndDispatch1879,newspaper-article,,"""A Female Crusoe. On an Island in the Pacific. Wild Woman Found on the Isolated Island of San Nicholas Seventy Miles from the California Coast,""",Female Crusoe. On an Island in the Pacific. Wild Woman Found on the Isolated Island of San Nicholas Seventy Miles from the California Coast,<i>Reading (PA) Times and Dispatch</i>,"42, ",no. 130,3,March,1879,1879-03-03,4,,,,,"Reading, Pennsylvania",Public domain,,,,,,,
Roberts1893,newspaper-article,"Edward Roberts,","""A Female Crusoe. Story of the Lone Woman of San Nicolas. She Returned for Her Child and Spent About Twenty Years on the Desolate Island,""",Female Crusoe. Story of the Lone Woman of San Nicolas. She Returned for Her Child and Spent About Twenty Years on the Desolate Island,<i>Los Angeles Herald</i>,"40,",no. 92,12,July,1893,1893-07-12,4,Ayers & Lynch,,,,"Los Angeles, California",Public domain,,,,,,,
RochesterDemocratAndChronicle1879,newspaper-article,"Absalom B. Stuart,","""A Woman Cruso[e]. An Almost Incredible Tale of the Pacific. Eighteen Years on a Lone Island Off Southern California,"" ",Woman Cruso[e]. An Almost Incredible Tale of the Pacific. Eighteen Years on a Lone Island Off Southern California ,<i>Rochester (NY) Democrat and Chronicle</i>,"47, ",no. 41,17,February,1879,1879-02-17,1,,,,,"Rochester, New York",Public domain,,,,,,,
RockyMountainNews1885,newspaper-article,"[Fred Spalding Witter],","""A Feminine Crusoe. Eighteen Years on a Desert Island—How She Lived and Dressed,"" ",Feminine Crusoe. Eighteen Years on a Desert Island—How She Lived and Dressed ,"<i>Rocky Mountain News</i> (Denver, CO)",27,,22,May,1885,1885-05-22,4,,,,,"Denver, Colorado",Public domain,,,,,,,
Russell1856_EB3(42),newspaper-article,,"""A California Crusoe. Narrative of a Woman Who Lived Eighteen Years Alone, upon the Island of San Nicolas,""","California Crusoe. Narrative of a Woman Who Lived Eighteen Years Alone, upon the Island of San Nicolas",<i>San Francisco Evening Bulletin</i>,"3,",no. 42,25,November,1856,1856-11-25,1,C.O. Gerberding,,,,"San Francisco, California",Public domain,,,,,,,
Russell1857_CC,newspaper-article,"C. J. W. Russell,","""A Female Crusoe,"" ",Female Crusoe ,"<i>Cayuga Chief</i> (Fort Atkinson, WI)","8,",no. 51,20,May,1857,1857-05-20,1,,,,,"Fort Atkinson, Wisconsin",Public domain,,,,,,,
Russell1857_CDT,newspaper-article,"C. J. W. Russell,","""A California Crusoe. Narrative of a Woman Who Lived 18 Years Alone on San Nicolas Island,""",California Crusoe. Narrative of a Woman Who Lived 18 Years Alone on San Nicolas Island,<i>Chicago Daily Tribune</i>,"10,",no. 264,16,April,1857,1857-04-16,3,"Wheeler, Stewart & Scripps",,,,"Chicago, Illinois",Public domain,,,,,,,
SacramentoDailyRecordUnion1881,newspaper-article,,"""Pacific Coast Items,""",Pacific Coast Items,<i>Sacramento Daily Record-Union</i>,,,19,February,1881,1881-02-19,8,,,,,"Sacramento, California",Public domain,,,,,,,
SacramentoDailyUnion1853_Nov1,newspaper-article,,"""The Wild Woman of California,"" ",Wild Woman of California ,<i>Sacramento Daily Union</i>,"6, ",no. 813,1,November,1853,1853-11-01,2,,,,,"Sacramento, California",Public domain,,,,,,,
SacramentoDailyUnion1853_Nov15,newspaper-article,,"""Wild Woman of San Nicholas,"" ",Wild Woman of San Nicholas,<i>Sacramento Daily Union</i>,"6, ",no. 825,15,November,1853,1853-11-15,2,,,,,"Sacramento, California",Public domain,,,,,,,
SacramentoDailyUnion1856,newspaper-article,"Juan José Warner,","""Further Particulars of the California Crusoe,""",Further Particulars of the California Crusoe,<i>Sacramento Daily Union</i>,"7, ",,29,December,1856,1856-12-29,1,E.G. Jefferis,,,,"Sacramento, California",Public domain,,,,,,,
SalemWeeklyReview1879,newspaper-article,,"""A Female Robinson Crusoe,"" ",Female Robinson Crusoe ,<i>Salem (NY) Weekly Review</i>,"2, ",no. 13,1,March,1879,1879-03-01,4,,,,,"Salem, New York",Public domain,,,,,,,
SaltLakeEveningDemocrat1885,newspaper-article,"[Fred Spalding Witter],","""A Feminine Crusoe. How She Lived Eighteen Years on a Desert Island,"" ",Feminine Crusoe. How She Lived Eighteen Years on a Desert Island ,<i>Salt Lake Evening Democrat</i>,"1,",no. 114,14,July,1885,1885-07-14,1,,,,,"Salt Lake City, Utah",Public domain,,,,,,,
