TheTelegraph1898,newspaper-article,,"""A Giant Race,""",Giant Race,<i>Brisbane (AUS) Telegraph</i>,,no. 7907,15,March,1898,1898-03-15,3,,,,,"Brisbane, Queensland, Australia",,,,"Australian periodicals published in this archive were found via the National Library of Australia’s Trove project: http://trove.nla.gov.au. If re-publishing, quoting from, or reproducing images from this digital archive with original publication in Australia, we request that you cite the original source provided via Trove, as well as the Lone Woman and Last Indians Digital Archive (Lone Woman and Last Indians Digital Archive, University of South Carolina, https://www.nps.gov/subjects/islandofthebluedolphins/index.htm). Information about Australia copyright law, including fair use, can be found here: http://www.nla.gov.au/copyright-in-library- collections.   

Responsibility for any use of the contents of the Lone Woman and Last Indians Digital Archive rests exclusively with the user.",,,,
TheTelegraphAndMessenger1885,newspaper-article,"[Fred Spalding Witter],","""A Feminine Crusoe. Eighteen Years on a Dessert Island—How She Lived and Dressed,"" ",Feminine Crusoe. Eighteen Years on a Dessert Island—How She Lived and Dressed ,<i>Macon (GA) Telegraph and Messenger</i>,"59, ",no. 26,29,May,1885,1885-05-29,6,,,,,"Macon, Georgia",Public domain,,,,,,,
TheTidings1904_Sep16,newspaper-article,"[Emma C. Hardacre],","""Eighteen Years Alone. A Tale of the Pacific,""",Eighteen Years Alone. A Tale of the Pacific,<i>Los Angeles Tidings</i>,"10, ",no. 38,16,September,1904,1904-09-16,"3, 7",,,,,"Los Angeles, California",Public domain,,,,,,,
TheTidings1904_Sep23,newspaper-article,"[Emma C. Hardacre],","""Eighteen Years Alone. A Tale of the Pacific. (Continued From Last Week.),""",Eighteen Years Alone. A Tale of the Pacific (Continued From Last Week),<i>Los Angeles Tidings</i>,"10, ",no. 39,23,September,1904,1904-09-23,"3, 6-7",,,,,"Los Angeles, California",Public domain,,,,,,,
TheTidings1904_Sep30,newspaper-article,"[Emma C. Hardacre],","""Eighteen Years Alone. A Tale of the Pacific. (Concluded.),""",Eighteen Years Alone. A Tale of the Pacific (Concluded),<i>Los Angeles Tidings</i>,"10, ",no. 40,30,September,1904,1904-09-30,3,,,,,"Los Angeles, California",Public domain,,,,,,,
TheTimaruHerald1892,newspaper-article,,"""The Isle of Skulls,""",Isle of Skulls,<i>Timaru (NZL) Herald</i>,"55, ",no. 5455,4,July,1892,1892-07-04,3,,,,,"Timaru, Canterbury, New Zealand",Public domain,,,"New Zealand periodicals published in this archive were found via the National Library of New Zealand’s Papers Past project: https://paperspast.natlib.govt.nz. If re-publishing, quoting from, or reproducing images from this digital archive with original publication in New Zealand, we request that you cite the original source at the National Library of New Zealand, as well as the Lone Woman and Last Indians Digital Archive (Lone Woman and Last Indians Digital Archive, University of South Carolina, https://www.nps.gov/subjects/islandofthebluedolphins/index.htm). Information about New Zealand copyright law, including fair use, can be found here: https://paperspast.natlib.govt.nz/copyright. 

Responsibility for any use of the contents of the Lone Woman and Last Indians Digital Archive rests exclusively with the user.",,,,
TheTimes1879,newspaper-article,,"""A Female Crusoe,"" ",Female Crusoe ,<i>Times</i> (London),,,4,March,1879,1879-03-04,7,,,,,"London, England, United Kingdom",Public domain,,,,,,,
TheTimes1885,newspaper-article,"[Fred Spalding Witter],","""A Feminine Crusoe. Eighteen Years on a Desert Island—How She Lived and Dressed,"" ",Feminine Crusoe. Eighteen Years on a Desert Island—How She Lived and Dressed ,<i>Philadelphia Times</i>,,no. 3532,16,May,1885,1885-05-16,7,,,,,"Philadelphia, Pennsylvania",Public domain,,,,,,,
TheTimes1887,newspaper-article,,"""Was It a Specter? Strange Experience of Two of Ventura's Young Men,""",Was It a Specter? Strange Experience of Two of Venturas Young Men,<i>Los Angeles Times</i>,"11, ",no. 30,7,January,1887,1887-02-01,9,,,,,"Los Angeles, California",Public domain,,Copyright 1961. Los Angeles Times. Reprinted with Permission.,Copyright 1961. Los Angeles Times. Reprinted with Permission.,,,,
TheTimes1899,newspaper-article,,"No title,","No title,",<i>Philadelphia Times</i>,,,30,April,1899,1899-04-30,19,,,,,"Philadelphia, Pennsylvania",Public domain,,,,,,,
TheTopekaDailyCapital1885,newspaper-article,"[Fred Spalding Witter],","""A Feminine Crusoe. How She Lived Eighteen Years on a Desert Island. The Story of the Lost Woman of San Nicolas—Her Ingenuity and Fertility of Invention—A Wonderful History,""",Feminine Crusoe. How She Lived Eighteen Years on a Desert Island. The Story of the Lost Woman of San Nicolas—Her Ingenuity and Fertility of Invention—A Wonderful History,<i>Topeka (KS) Daily Capital</i>,"7, ",no. 142,17,June,1885,1885-06-17,6,,,,,"Topeka, Kansas",Public domain,,,,,,,
TheUpperDesMoines1892,newspaper-article,,"""The Isle of Skulls. A Woman's Lonely Life—Surrounded by the Bones of Her Tribe,"" ",Isle of Skulls. A Womans Lonely Life—Surrounded by the Bones of Her Tribe,"<i>Upper Des Moines</i> (Algona, IA)","27, ",no. 5,27,April,1892,1892-04-27,10,,,,,"Algona, Iowa",Public domain,,,,,,,
TheVermontJournal1847,newspaper-article,,"""A Female Crusoe,"" ",Female Crusoe ,<i>Vermont Journal</i>,"4, ",no. 12,10,September,1847,1847-09-10,1,,,,,"Windsor, Vermont",Public domain,,,,,,,
TheWashingtonPost1905,newspaper-article,"[Frank Gassaway],","""Story of a Woman Crusoe. Unlike Defoe's Hero, Her End Is Pathetic in the Extreme,""","Story of a Woman Crusoe. Unlike Defoes Hero, Her End Is Pathetic in the Extreme",<i>Washington Post</i>,,,2,July,1905,1905-07-02,11,,,,,"Washington, DC",Public domain,,,,,,,
TheWeeklyFreePress1891,newspaper-article,,"""Miles of Human Bones. Discoveries of a Party Who Went to San Nicholas. The Island Entirely Destitute of Productive Soil—A Few Sheep Found There,"" ",Miles of Human Bones. Discoveries of a Party Who Went to San Nicholas. The Island Entirely Destitute of Productive Soil—A Few Sheep Found There ,<i>Ventura (CA) Weekly Free Press</i>,"17, ",no. 34,28,August,1891,1891-08-28,1,,,,,"Ventura, California",Public domain,,,,,,,
TheWesternChampion1892,newspaper-article,,"""A Terrible Country. Covered with Skeletons,""",Terrible Country. Covered with Skeletons,<i>Barcaldine (AUS) Western Champion and General Advertiser for the Central-Western Districts</i>,2,no. 33,6,September,1892,1892-09-06,11,,,,,"Barcaldine, Queensland, Australia",,,,"Australian periodicals published in this archive were found via the National Library of Australia’s Trove project: http://trove.nla.gov.au. If re-publishing, quoting from, or reproducing images from this digital archive with original publication in Australia, we request that you cite the original source provided via Trove, as well as the Lone Woman and Last Indians Digital Archive (Lone Woman and Last Indians Digital Archive, University of South Carolina, https://www.nps.gov/subjects/islandofthebluedolphins/index.htm). Information about Australia copyright law, including fair use, can be found here: http://www.nla.gov.au/copyright-in-library- collections. 

Responsibility for any use of the contents of the Lone Woman and Last Indians Digital Archive rests exclusively with the user.",,,,
TheWichitaDailyEagle1892,newspaper-article,,"""The Isle of Skulls. A Woman's Lonely Life Surrounded by the Bones of Her Tribe,""",Isle of Skulls. A Womans Lonely Life Surrounded by the Bones of Her Tribe,<i>Wichita (KS) Daily Eagle</i>,16,no. 138,26,April,1892,1892-04-26,6,,,,,"Wichita, Kansas",,,,,,,,
TheWilsonMirror1893,newspaper-article,"[Edwards Roberts],","""A Female Crusoe,"" ",Female Crusoe ,<i>Wilson (NC) Mirror</i>,"12, ",no. 22,6,September,1893,1893-09-06,2,,,,,"Wilson, North Carolina",Public domain,,,,,,,
TheWorthingtonAdvance1887,newspaper-article,,"""An Indian Ghost,""",Indian Ghost,<i>Worthington (MN) Advance</i>,15,no. 31,24,March,1887,1887-03-24,"Minnesota Law Supplement, 11",,,,,"Worthington, Minnesota",Public domain,,,,,,,
TheYouthsCompanion1880,newspaper-article,,"""A Female Crusoe,""",Female Crusoe,<i>Boston Youth's Companion</i>,"53, ",no. 40,30,September,1880,1880-09-30,329,,,,,"Boston, Massachusetts",Public domain,,,,,,,
TiffinTribune1879,newspaper-article,"[Absalom B. Stuart],","""A Female Crusoe,"" ",Female Crusoe ,<i>Tiffin (OH) Tribune</i>,"31, ",no. 27,3,April,1879,1879-04-03,1,,,,,"Tiffin, Ohio",Public domain,,,,,,,
Tinsley1901,newspaper-article,"Henry G. Tinsley,","""Island of Mystery. San Nicolas, One of the Channel Islands, Pacific Coast. Little of It Known to World. An Expedition from the University of California Will Soon Explore the Grewsome Land That Is Spread Over with the Skulls and Jawbones of a Lost Race—How the Indian Inhabitants Became Extinct—'Lone Woman of San Nicolas,'""","Island of Mystery. San Nicolas, One of the Channel Islands, Pacific Coast. Little of It Known to World. An Expedition from the University of California Will Soon Explore the Grewsome Land That Is Spread Over with the Skulls and Jawbones of a Lost Race—How the Indian Inhabitants Became Extinct—Lone Woman of San Nicolas",<i>Washington Post</i>,,,13,October,1901,1901-10-13,24,,,,,"Washington, DC",Public domain,,,,,,,
Trott1964,newspaper-article,"Harlan Trott,","""Island Mystery about Kind Mrs. Robinson Crusoe,""",Island Mystery about Kind Mrs. Robinson Crusoe,<i>Christian Science Monitor</i>,"56,",no. 44,17,January,1964,1964-01-17,Second Sec. 2,,,,,"Boston, Massachusetts",Y,,"They are giving us permission to print the ARTICLE only, not the page on which it appears. Nothing we can do about that. Could you please make a clear note of that in the masterlist? Copyright information:
 
 ""By Harlan Trott. Reprinted with permission from the January 17, 1964 issue of The Christian Science Monitor. © 1964 The Christian Science Monitor (www.CSMonitor.com).""","By Harlan Trott. Reprinted with permission from the January 17, 1964 issue of The Christian Science Monitor. © 1964 The Christian Science Monitor (www.CSMonitor.com).  Further reproduction prohibited.",,,,
UticaDailyObserver1879,newspaper-article,,"""A Feminine Crusoe. A Strange Tale from the Pacific Ocean. A Woman Alone on a Dreary, Desert Island for Eighteen Years,""","Feminine Crusoe. A Strange Tale from the Pacific Ocean. A Woman Alone on a Dreary, Desert Island for Eighteen Years",<i>Utica (NY) Daily Observer</i>,"31,",no. 245,19,February,1879,1879-02-19,1,Grove & Bailey,,,,"Utica, New York",Public domain,,,,,,,
UticaObserver1885,newspaper-article,"[Fred Spalding Witter],","""A Feminine Crusoe. How She Lived Eighteen Years on a Desert Island. The Story of the Lost Woman of San Nicolas—Her Ingenuity and Fertility of Invention—a Wonderful History,""",Feminine Crusoe. How She Lived Eighteen Years on a Desert Island. The Story of the Lost Woman of San Nicolas—Her Ingenuity and Fertility of Invention—a Wonderful History,<i>Utica (NY) Observer</i>,"38,",no. 42,13,June,1885,1885-06-13,3,E.P. Bailey,,,,"Utica, New York",Public domain,,,,,,,
Warner1856_EB,newspaper-article,"Juan José Warner,","""Further Particulars of the California Crusoe,""",Further Particulars of the California Crusoe,<i>San Francisco Evening Bulletin</i>,"3,",no. 69,27,December,1856,1856-12-27,1,C.O. Gerberding,,,,"San Francisco, California",Public domain,,,,,,,
Warner1856_LAS,newspaper-article,"Juan José Warner,","""Interesting Narrative,""",Interesting Narrative,<i>Los Angeles Star</i>,"6,",no. 31,13,December,1856,1856-12-13,2,James S. Waite,,,,"Los Angeles, California",Public domain,,,,,,,
Warner1894,newspaper-article,"Juan José Warner,","""Catalina Island's Lost Tribe. Strange People Who Lived by Themselves. Dialect of the California Indian Unknown to Them. A Raid by Sea After Hunters Cost the Natives Many Lives--The Squaw Hermit,""",Catalina Islands Lost Tribe. Strange People Who Lived by Themselves. Dialect of the California Indian Unknown to Them. A Raid by Sea After Hunters Cost the Natives Many Lives--The Squaw Hermit,<i>Los Angeles Herald</i>,,,25,December,1894,1894-12-25,11,,,,,"Los Angeles, California",Public domain,,,,,,,
WatkinsExpress1879,newspaper-article,,"""A Feminine Crusoe. Alone on a Dreary, Desert Island for Eighteen Years,""","Feminine Crusoe. Alone on a Dreary, Desert Island for Eighteen Years","<i>Watkins (Watkins Glen, NY) Express</i>","25,",no. 41,27,February,1879,1879-02-27,1,Levi M. Gano,,,,"Watkins Glen, New York",Public domain,,,,,,,
WeeklyIrishTimes1896,newspaper-article,,"""Isles of Mystery,"" ",Isles of Mystery ,<i>Weekly Irish Times</i>,,,10,December,1896,1896-12-10,"Grand Christmas Extra Number, 3",,,,,"Dublin, Ireland, United Kingdom",Public domain,,,,,,,
WeeklyNewsAndDemocrat1885,newspaper-article,"[Fred Spalding Witter],","""A Feminine Crusoe. How She Was Abandoned—Eighteen Years on a Desert Island—How She Lived and Dressed,"" ",Feminine Crusoe. How She Was Abandoned—Eighteen Years on a Desert Island—How She Lived and Dressed ,<i>Auburn (NY) Weekly News and Democrat</i> ,"14, ",no. 27,11,June,1885,1885-06-11,6,,,,,"Auburn, New York",Public domain,,,,,,,
WeeklyWisconsin1853,newspaper-article,"[Goliah],","""A Female Robinson Crusoe,"" ",Female Robinson Crusoe ,<i>Weekly Wisconsin</i>,"7, ",no. 26,16,November,1853,1853-11-16,1,,,,,"Milwaukee, Wisconsin",Public domain,,,,,,,
WesternDemocrat1857,newspaper-article,"C. J. W. Russell,","""A California Cruise [Crusoe]. Narrative of a Woman Who Lived Eighteen Years Alone Upon the Island of San Nicholas,""",California Cruise [Crusoe]. Narrative of a Woman Who Lived Eighteen Years Alone Upon the Island of San Nicholas,<i>Charlotte (NC) Western Democrat</i>,5,no. 33,17,February,1857,1857-02-17,1,,,,,"Charlotte, North Carolina",,,,,,,,
WilmingtonJournal1857,newspaper-article,"C. J. W. Russell,","""A California Cruise [Crusoe]. Narrative of a Woman Who Lived Eighteen Years Alone Upon the Island of San Nicholas,""",California Cruise [Crusoe]. Narrative of a Woman Who Lived Eighteen Years Alone Upon the Island of San Nicholas,<i>Wilmington (NC) Journal</i>,13,no. 24,13,February,1857,1857-02-13,1,,,,,"Wilmington, North Carolina",,,,,,,,
WisconsinHerald1847,newspaper-article,,"""A Female Crusoe,"" ",Female Crusoe ,<i>Wisconsin Herald</i>,"5, ",no. 1,13,March,1847,1847-03-13,1,,,,,"Lancaster, Wisconsin",Public domain,,,,,,,
Witter1885_DAC,newspaper-article,"Fred Spalding Witter,","""Sanitarium of the West. Rambles about San Francisco and down the Pacific Coast. Stories of Spanish Fathers. Barbara, the Saint—the Lost Woman of San Nicolas—Remains of the Old Museum—Traces of the Mound Builders—Golden Gate,""","Sanitarium of the West. Rambles about San Francisco and down the Pacific Coast. Stories of Spanish Fathers. Barbara, the Saint—the Lost Woman of San Nicolas—Remains of the Old Museum—Traces of the Mound Builders—Golden Gate",<i>Rochester (NY) Democrat and Chronicle</i>,"53,",no. 88,29,March,1885,1885-03-29,3,Rochester Print.,,,,"Rochester, New York",Public domain,,,,,,,
Witter1885_TAC,newspaper-article,"[Fred Spalding Witter],","""A Feminine Crusoe,""",Feminine Crusoe,<i>Atlanta (GA) Constitution</i>,,,20,May,1885,1885-05-20,6,Constitution,,,,"Atlanta, Georgia",Public domain,,,,,,,
Yates1892_29Feb,newspaper-article,"Lorenzo G. Yates,","""The Lost Woman. A Grossly Erroneous Version of the Story. Joaquin Miller Writes History to Suit Himself—The Location of the Channel Islands—That 'Castle,'"" ",Lost Woman. A Grossly Erroneous Version of the Story. Joaquin Miller Writes History to Suit Himself—The Location of the Channel Islands—That Castle,<i>Santa Barbara (CA) Daily Independent</i>,"18, ",no. 98,29,February,1892,1892-02-29,4,,,,,"Santa Barbara, California",Public domain,,,,,,,
AlleganyCountyRepublican1901,newspaper-article,"[M.E. Dudley],","""The Woman of San Nicolas Island. A Strange Story of the Pacific Coast,""",Woman of San Nicolas Island. A Strange Story of the Pacific Coast,<i>Allegany County (NY) Republican</i>,"81, ",no. 43,25,October,1901,1901-10-25,2,,,,,"Friendship, New York",Public domain,,,,,,,
Robinson2004-Adrift,newspaper-article,"Joe Robinson,","""Adrift in a Sea of Fiction,""",Adrift in a Sea of Fiction,<i>Los Angeles Times</i>,,,15,June,2004,2004-06-15,F5,,,,,"Los Angeles, California",Y,,Copyright 1961. Los Angeles Times. Reprinted with Permission.,Copyright 1961. Los Angeles Times. Reprinted with Permission.,,,,Y--cover of IotBD
Miller1891,newspaper-article,"Joaquin Miller, ","""Mrs. Robinson Crusoe, of California. De Foe's Hero Outdone by an Heroic Indian Woman of Cunning Intelligence. Twenty-five years alone. Joaquin Miller's Quaint Sketch of the Lonely Denizen of an Island Off the Western Coast,"" ","Mrs. Robinson Crusoe, of California. De Foes Hero Outdone by an Heroic Indian Woman of Cunning Intelligence. Twenty-five years alone. Joaquin Millers Quaint Sketch of the Lonely Denizen of an Island Off the Western Coast ",<i>New York Herald</i>,,no. 116,26,April,1891,1891-04-26,13,,,,,"New York, New York",Public domain,,,,,,,Y--depiction of LW
StLouisRepublic1893,newspaper-article,"[James M. Gibbons],","""A Feminine Crusoe. She Lived Seventeen Years Alone on an Island. Rescued to Die the Sooner—A Strange Story 'Juana Maria Better-Than-Nothing's' Adventures on a Desert Island,"" ",Feminine Crusoe. She Lived Seventeen Years Alone on an Island. Rescued to Die the Sooner—A Strange Story Juana Maria Better-Than-Nothings Adventures on a Desert Island ,<i>St. Louis Republic</i>,"86,",,14,October,1893,1893-10-14,Pt. 2 p. 10,,,,,"St. Louis, Missouri",Public domain,,,,,,,Y--depiction of LW
TheBryanDailyEagle1897,newspaper-article,,"""Golgotha of Pacific. An Island Covered with Old Human Bones. Extinct Race of Veritable Giants—Capture of Sole Survivor of the Ancient Race That Inhabited San Nicolas Island,"" ",Golgotha of Pacific. An Island Covered with Old Human Bones. Extinct Race of Veritable Giants—Capture of Sole Survivor of the Ancient Race That Inhabited San Nicolas Island,<i>Bryan (TX) Daily Eagle</i>,"2, ",no. 178,26,June,1897,1897-06-26,2,,,,,"Bryan, Texas",Public domain,,,,,,,Y--depiction of LW
TheWorld1899,newspaper-article,,"""Expedition to Clear up the Mystery of the Wild Woman of San Nicolas Island: The Dress of Feathers Which Maria Better Than Nothing Sewed for Herself out of Skins of Birds Sent to the Propagandist Museum in Rome—Further Details Anxiously Sought of the Woman Who, for the Sake of Her Child, Lived Alone on California Island for Twenty Years—the Child Died Long Ago—the Mother, Crazed by Grief and Sufferings, Now Rests in Holy Ground,""","Expedition to Clear up the Mystery of the Wild Woman of San Nicolas Island The Dress of Feathers Which Maria Better Than Nothing Sewed for Herself out of Skins of Birds Sent to the Propagandist Museum in Rome—Further Details Anxiously Sought of the Woman Who, for the Sake of Her Child, Lived Alone on California Island for Twenty Years—the Child Died Long Ago—the Mother, Crazed by Grief and Sufferings, Now Rests in Holy Ground",<i>New York World</i>,"40,",no. 14012,31,December,1899,1899-12-31,"Sunday Magazine Supplement, 6",,,,,"New York, New York",Public domain,,,,,,,Y--depiction of LW being found by GN
Robinson2004-Marooned,newspaper-article,"Joe Robinson,","""Marooned,""",Marooned,<i>Los Angeles Times</i>,,,15,June,2004,2004-06-15,"F1, F4-F5",,,,,"Los Angeles, California",Y,,Copyright 1961. Los Angeles Times. Reprinted with Permission.,Copyright 1961. Los Angeles Times. Reprinted with Permission.,,,,"Y--depiction of LW, images of SNI"
NewYorkHerald1896,newspaper-article,,"""Isles of Mystery. Mementos of a Dead Past and an Extinct Race in the Pacific. The Channel Islands. Thoroughly Explored at Last by Professor Charles Frederick Holden. San Nicolas' Lone Woman. Remains That Tell of an Interesting Tribe of Aesthetic Tastes,"" ",Isles of Mystery. Mementos of a Dead Past and an Extinct Race in the Pacific. The Channel Islands. Thoroughly Explored at Last by Professor Charles Frederick Holden. San Nicolas Lone Woman. Remains That Tell of an Interesting Tribe of Aesthetic Tastes,<i>New York Herald</i>,,,22,November,1896,1896-11-22,Sixth Sec. 7,,,,,"New York, New York",Public domain,,,,,,,Y--depiction of SNI artifact
Julian1901_TBH,newspaper-article,"Edward Julian,","""Stories of Riches. They Come from All Parts of Our Wonderful Country. New Deposits of Precious Metals and Minerals Discovered in the Far West—the Wonders of San Nicolas,"" ",Stories of Riches. They Come from All Parts of Our Wonderful Country. New Deposits of Precious Metals and Minerals Discovered in the Far West—the Wonders of San Nicolas,<i>Beaver (OK) Herald</i>,"15, ",no. 33,19,December,1901,1901-12-19,2,,,,,"Beaver, Oklahoma",Public domain,,,,,,,Y--depiction of SNI Stone Forest
TheNewYorkPress1901,newspaper-article,"Henry G Tinsely,","""To Explore the Strange Island of San Nicolas: An Expedition from the University of California Will Visit the Grewsome Land That is Spread Over with Skulls and Thighbones of a Lost Race,""",To Explore the Strange Island of San Nicolas An Expedition from the University of California Will Visit the Grewsome Land That is Spread Over with Skulls and Thighbones of a Lost Race,<i>New York Press</i>,"14,",,13,October,1901,1901-10-13,"Sunday Magazine Supplement, 1",,,,,"New York, New York",Public domain,,,,,,,Y--depictions of Indians/bones/SNI
TheEveningPost1896,newspaper-article,,"""The Lost Woman of San Nicolas Island: A Romance of California Pioneer Days,"" ",Lost Woman of San Nicolas Island A Romance of California Pioneer Days,<i>San Francisco Evening Post</i>,"50, ",no. 21,25,July,1896,1896-07-25,9,,,,,"San Francisco, California",Public domain,,,,,,,Y--depictions of LW
Oregonian1901,newspaper-article,"[Henry G. Tinsley],","""To Explore the Strange Island of San Nicolas: An Expedition from the University of California Will Visit the Grewsome Land That is Spread Over with Skulls and Thighbones of a Lost Race,"" ",To Explore the Strange Island of San Nicolas An Expedition from the University of California Will Visit the Grewsome Land That is Spread Over with Skulls and Thighbones of a Lost Race,<i>Sunday Oregonian</i>,"20, ",no. 42,20,October,1901,1901-10-20,32,,,,,"Portland, Oregon",Public domain,,,,,,,Y--depictions of SNI and natives
ThePittsburgPress1901,newspaper-article,"[Henry G. Tinsley],","""To Explore the Strange Island of San Nicolas: An Expedition from the University of California Will Visit the Grewsome Land That is Spread Over with Skulls and Thighbones of a Lost Race,"" ",To Explore the Strange Island of San Nicolas An Expedition from the University of California Will Visit the Grewsome Land That is Spread Over with Skulls and Thighbones of a Lost Race,<i>Pittsburg Press</i>,"18, ",no. 283,12,October,1901,1901-10-12,"Sunday Magazine, 8",,,,,"Pittsburg, Pennsylvania",Public domain,,,,,,,Y--depictions of SNI and natives
SanFranciscoChronicle1894,newspaper-article,,"""A Romance of the Sea. Relics of a Lost Tribe of Indians. The Cruise of the Schooner Alexander. Upturned Graves of a Once Mighty People on San Nicolas Island,"" ",Romance of the Sea. Relics of a Lost Tribe of Indians. The Cruise of the Schooner Alexander. Upturned Graves of a Once Mighty People on San Nicolas Island ,<i>San Francisco Chronicle</i>,"60, ",no. 145,7,December,1894,1894-12-07,4,,,,,"San Francisco, California",Public domain,,,,,,,Y--depictions of SNI artifacts
Edwords1906,newspaper-article,"Clarence E. Edwords,","""A Female Crusoe on the Island Of Skulls,"" ",Female Crusoe on the Island Of Skulls ,<i>San Francisco Chronicle</i>,"89, ",no. 170,30,December,1906,1906-12-30,"Sunday Supplement, 5",,,,,"San Francisco, California",Public domain,,,,,,,"Y--drawing of LW, scenes from SNI"
Holder1892,newspaper-article,"Charles Frederick Holder,","""A Four-in-Hand in Southern California,"" ",Four-in-Hand in Southern California ,<i>Californian Illustrated Magazine</i>,"1,",no. 1,,October,1891,1891-10-01,326-35 ,,,,,"San Francisco, California",Public domain,,,,,,,"Y--drawing of Santa Barbara Bay, drawing of Mission SB, Drawing houses, drawing fording the stream, drawing Castle Rock"
ChicagoDailyTribune1902,newspaper-article,"[Henry G. Tinsley],","""To Explore the Strange Island of San Nicolas: An Expedition from the University of California Will Visit the Grewsome Land That is Spread Over with Skulls and Thighbones of a Lost Race,""",To Explore the Strange Island of San Nicolas An Expedition from the University of California Will Visit the Grewsome Land That is Spread Over with Skulls and Thighbones of a Lost Race,<i>Chicago Daily Tribune</i>,"50,",no. 61,2,March,1902,1902-03-02,58,Tribune,,,,"Chicago, Illinois",Public domain,,,,,,,Y--drawings of SNI and expedition
Brantingham1993,newspaper-article,"Barney Brantingham,","""Island Woman's Origins Still Hotly Debated,""",Island Womans Origins Still Hotly Debated,<i>Santa Barbara (CA) News-Press</i>,,,11,July,1993,1993-07-11,B2,,,,,"Santa Barbara, California",Y,$25 for 3 articles,Courtesy of Santa Barbara News-Press,Courtesy of Santa Barbara News-Press.,,,,Y--graphic and image of LW plaque at SBMission
Hall1900,newspaper-article,"Percy W. Hall, ","""The Sad Story of a Vanquished Race: Characteristics of the People Who Once Inhabited the Nearby Islands,""",Sad Story of a Vanquished Race Characteristics of the People Who Once Inhabited the Nearby Islands,<i>Daily Los Angeles Herald</i>,"27,",no. 315,12,Aug.,1900,1900-08-12,"Illustrated Sunday Supplement, 8",Ayers & Lynch,,,,"Los Angeles, California",Public domain,,,,,,,Y--image from SNI
