Daily1989,journal-article,"Marla Daily,","""The Lone Woman of San Nicolas Island: A New Hypothesis on Her Origin,""",Lone Woman of San Nicolas Island A New Hypothesis on Her Origin,<i>California History</i>,"68, ",no. 1/2,,Spring/Summer,1989,1989-03-01,"36-41, 65",,,,,"Oakland, California",,,,Courtesy of California Historical Society.,,,,"Y-Photo of plaque in Santa Barbara Mission cemetary honoring Juana Maria, image of Emma Hardacre's diary (entry about Juana Maria) "
Dall1874,magazine-article,"W. H. Dall, ","""The Lords of the Isles,""",Lords of the Isles,<i>Overland Monthly</i>,"12,",no. 6,15,June,1874,1874-06-15,522-26,,,,,"San Francisco, California",Public domain,,,,,,,
McDougall1890,magazine-article,"William H. McDougall, ","""A Woman's Log of 1849: From the Diary of Mrs. John McDougall,""",Womans Log of 1849 From the Diary of Mrs. John McDougall,<i>Overland Monthly</i>,"16,",no. 93,,September,1890,1890-09-01,273-80,,,,,"San Francisco, California",Public domain,,,,,,,
Paul1911,magazine-article,"Oliver M. Paul, ","""Female Robinson Crusoe: A True Tale of the Santa Barbara Islands,""",Female Robinson Crusoe A True Tale of the Santa Barbara Islands,<i>Overland Monthly</i>,"58,",no. 3,15,July,1911,1911-07-15,208-12,,,,,"San Francisco, California",Public domain,,,,,,,
Pioneer1988,magazine-article,,"""The Forgotten Woman of San Nicolas.""",Forgotten Woman of San Nicolas,<i>Pioneer</i>,11,,,November,1988,1988-11-01,54,Pravda,,,,"Moscow, Russia, USSR",,,,,,,,
Schumacher1875,magazine-article,"Paul Schumacher,","""Some Remains of a Former People,""",Some Remains of a Former People,<i>Overland Monthly</i>,"15,",no. 4,,October,1875,1875-10-01,374-79,,,,,"San Francisco, California",Public domain,,,,,,,
ShipwreckedMariner1879,magazine-article,,"""A Female Crusoe,""",Female Crusoe,<i>Shipwrecked Mariner</i>,26,no. 103,,June,1879,1879-06-01,159-60,T.F. Unwin,,,,"London, England, United Kingdom",Public domain,,,,,,,
Stuart1880,magazine-article,"Absalom B. Stuart, ","""An Indian Woman Eighteen Years Alone on the Island of San Nicolas, off the Coast of Southern California. Physical Condition Good; Recollected Events, but Had Lost All Knowledge of the Computation of Time and the Dialect of her Tribe,""","Indian Woman Eighteen Years Alone on the Island of San Nicolas, off the Coast of Southern California. Physical Condition Good; Recollected Events, but Had Lost All Knowledge of the Computation of Time and the Dialect of her Tribe",<i>Sanitarian</i>,"8, ",no. 90,,September,1880,1880-09-01,400-06,,,,,"New York, New York",Public domain,,,,,,,
TheLivingAge1847,magazine-article,,"""A Female Crusoe,""",Female Crusoe,<i>Littell's Living Age</i>,"12,",no. 150,27,March,1847,1847-03-27,594-95,,,,,"Ithaca, New York",Public domain,,,,,,,
Walcott1872,magazine-article,"Josephine Walcott, ","""Hona Maria,""",Hona Maria,<i>Overland Monthly</i>,"9,",no. 2,,August,1872,1872-08-01,173-75,,,,,"San Francisco, California",Public domain,,,,,,,
TelleenLawton2013_Mag,magazine-article,"Karen Telleen-Lawton,","""The Lone Woman of San Nicolas Island,""",Lone Woman of San Nicolas Island,<i>Santa Barbara (CA) Seasons</i>,,,,July,2013,2013-07-01,66-68,,,,,"Santa Barbara, California",Y,,,Courtesy of Seasons Magazine: Santa Barbara.,,,,"Y--depiction of LW, depiction of sea animals, image of Juana Maria's plaque"
Woodward1931,magazine-article,"[Arthur Woodward],","""An Indian Woman: San Nicolas Island, Santa Barbara Channel,""","Indian Woman San Nicolas Island, Santa Barbara Channel","<i>Sierra Educational News</i> (San Francisco, CA)",,,,March,1931,1931-03-01,32,,,,Owned by California State Teachers Association,"San Francisco, California",Y,no,California State Teachers Association (they granted permission),Reprinted with permission of California State Teachers Association.,,,,Y--depiction of SNI
Yates1896,magazine-article,"Lorenzo Gordin Yates,","""The Deserted Homes of a Lost People: The Santa Barbara Channel Islands,""",Deserted Homes of a Lost People The Santa Barbara Channel Islands,<i>Overland Monthly</i>,"27,",no. 161,,May,1896,1896-05-01,538-44,,,,,"San Francisco, California",Public domain,,,,,,,"Y--depictions of SNI Indians/artifact (?), images of SNI bones, coast cliffs,  abalone shells, SNI coast & caves"
King2013,magazine-article,"Richard King,","""Animals in Sea History: Sea Otter,""",Animals in Sea History Sea Otter,<i>Sea History Magazine</i>,,no. 145,,Winter,2013,2013-12-01,40-41,National Maritime Historical Society,,,,"Peekskill, New York",Y,$0,Courtesy of Sea History Magazine and Richard King,Courtesy of Sea History Magazine and Richard King.,,,,"Y--drawing of LW, drawing of otter, images of Aleutians and otter skins"
Kinsell1891,magazine-article,"Martinette Kinsell,","""The Santa Barbara Islands,""",Santa Barbara Islands,<i>Overland Monthly</i>,"13,",no. 40,,December,1891,1891-12-01,617-31,,,,,"San Francisco, California",Public domain,,,,,,,Y--images of SNI & Channel Islands
Clifford1921,magazine-article,"Josephine Clifford,","""Hona Maria,""",Hona Maria,<i>Overland Monthly</i>,"78,",no. 5,,November,1921,1921-11-01,11-13,,,,,"San Francisco, California",Public domain,,,,,,,Y--scenes of SNI
Bennett1898,magazine-article,"John E. Bennett,","""Our Seaboard Islands of the Pacific,""",Our Seaboard Islands of the Pacific,<i>Harper's New Monthly Magazine</i>,"97,",no. 582,,November,1898,1898-11-01,852-62,,,,,"Ithaca, New York",Public domain,,,,,,,Y--scenes of SNI (13 images total)
McBride1992,magazine-article,"Woody McBride,","""The Lone Woman of San Nicolas Island,""",Lone Woman of San Nicolas Island,<i>Fedco Reporter</i>,,,,October,1992,1992-10-01,17,,,,,"Los Angeles, California",Y,,"""The California State University, Lost Angeles, John F. Kennedy Memorial Library, Fedco Superstores, Inc. collection.""","Reprinted with permission from The California State University, Lost Angeles, John F. Kennedy Memorial Library, Fedco Superstores, Inc. collection.",,,,Y--title graphic
Woodward1930,magazine-article,"Arthur Woodward,","""A Female Robinson Crusoe,""",Female Robinson Crusoe,<i>Adventure Magazine</i>,,,1,February,1930,1930-02-01,140-41,,,,,"New York, New York","Y--magazine defunct, copyright owner could not be located",,,,,,,Y--title image linked?
Dittman1878,manuscript,"Carl Dittman,","<i>Narrative of a Seafaring Life on the Coast of California</i>,","Narrative of a Seafaring Life on the Coast of California,",Manuscript C-D67,,,,,1878,1878-01-01,,Manuscript C-D67,1878,Bancroft Library,"University of California, Berkeley",N/A,Y,"$1,530",(paid by Richard Dittman),"Courtesy of The Bancroft Library, University of California, Berkeley.  Funding for the production of these digital scans was generously provided by Richard H. Dittman.",,,"Carl Dittman’s personal narrative, including his role in locating and transporting the Lone Woman to mainland California, has long been overshadowed by George Nidever’s.  As captain of the fateful 1853 expedition to San Nicolas that resulted in the Lone Woman’s removal to mainland California, the fifty-year-old Nidever outranked the significantly younger Dittman, who on this journey was merely a member of the crew.  Moreover, it was Nidever and his wife, not Dittman, who housed the island woman once the hunting party returned to Santa Barbara with the Lone Woman in tow.  

George Nidever also had better press.  In 1928, the Daughters of the American Revolution erected a plaque at the Santa Barbara Mission commemorating the discovery and rescue of the Lone Woman.  The historical marker, which is still standing, gives Captain George Nidever sole credit.  And in 1937, the University of California Press published Nidever’s <i>Life and Adventures</i>, a narrative that at 165 hand-written pages dwarfs Dittman’s 48-page dictation, still unpublished to this day.  The two men’s differing relationships to the United States as a nation may be another factor in their subsequent memorialization.  George Nidever was a native-born American whose parents were also native born (his father from Pennsylvania, his mother from Virginia).  Nidever’s journey to California follows the typical east to west pattern of American expansion and accompanying concept of Manifest Destiny.  After a childhood in Tennessee, North Carolina, and Missouri, Nidever began a series of travels that progressively moved him west to Mexican California.  Here, he participated in the Mexican-American War, fighting alongside John C. Frémont and accompanying the Lieutenant-Colonel to Cahuenga, where articles of capitulation were signed.  (The Treaty of Cahuenga preceded the Treaty of Guadulupe Hidalgo, which officially ended hostilities between the United States and Mexico and resulted in the United States gaining northern California and land including present-day Arizona and New Mexico, as well as portions of Utah, Nevada, and Colorado.)  Nidever therefore directly contributed to the expansion of U.S. territory. 

Frontier or borderland spaces such as the nineteenth-century American west ease barriers to mobility presented by race, class, and gender, but they never erase them entirely.  Unlike Nidever, Carl Dittman was foreign-born, arriving in Santa Barbara, California in 1844 as a citizen of Prussia.  Dittman took to the sea as an adolescent, escaping an unhappy apprenticeship, according to family stories.<sup>1</sup>  After several years as a seaman, Dittman settled in Mexican California, where he engaged in a variety of jobs including managing a storehouse, farming, mining for gold, and especially, sea otter hunting.  Dittman was often known as Charley Brown, and the confusion over his name points to his ""foreignness.""  As he dictated to Edward Murray, ""My right name is Carl Dittman although I am generally called Charley Brown, having adopted this latter name while I was a sailor.  My native place is Ueckamünde, about 30 miles from Berlin, Prussia.  I went to sea while still a boy, making my first voyage with Capt. Ratman who belonged in my town.""  

As Mexico and the United States struggled for control of California, Dittman’s foreign citizenship was at times a benefit.  During an 1846 sea otter hunting expedition, for example, Dittman traveled with a Scot (Bill Fife), two Americans (George Nidever and [Reading] McCoy), and ""Mission indians [sic] from various Missions.""  When the group reached Santa Barbara, they were met by six Californios who arrested them, as the Mexican-American War had begun.  According to Dittman’s narrative, only he and Fife, the non-Americans, were released.  

But while foreign citizenship might be desirable when California’s future was uncertain, it was less so once California was incorporated into the United States.  In March 1849 and again in the spring of 1850, Dittman mined for gold at the Stanislaus diggings.  He doesn’t discuss taxes in his narrative, but during this period, a ""foreign miners’ tax"" was levied against non-U.S. fortune seekers.  Well after his contact with the Lone Woman, Dittman began the process of seeking U.S. citizenship.  He submitted a Letter of Intent for naturalization on 20 July 1867, and on 31 July 1871, his citizenship was granted in the Court of the First Judicial District in Santa Barbara. <sup>2</sup>  During this period, the wife and children (under age 21) of a naturalized man gained U.S. citizenship automatically.

Dittman’s <i>Narrative</i> mentions neither his naturalization nor a wife and children.  Other records, however, indicate that Dittman established a family (marriage is uncertain) with Francisca Cascareña, who was born at Mission San Luis Rey, in Alta California, around 1825.  Francisca was likely a Payómkawichum (Lusiña or Luiseña), a Mission Indian.  Although she was born after Mexican independence, the Spanish missions underwent a long, uneven process of secularization.  Church, census, and court records indicate that Carl Dittman and Francisca Cascareña had two children, Maria Juana (later Mary) and Charles.  In 1861, Charles Dittman declared himself the legal father of these children, born of an Indian woman. <sup>3</sup>

As a naturalized citizen who married a Mission Indian, Carl Dittman lacked some of Nidever’s trappings as American pioneer for those interested in creating mythic narratives of the United States at the end of the nineteenth century.  This may explain his muted appearance in early accounts of the Lone Woman.

End Notes

<sup>1</sup> Richard H. Dittman, ""Good Grief, Charley Brown!"" <i>Ancestors West</i> 31, nos. 1-2 (2004-05): 13-15.
<sup>2</sup> Richard H. Dittman, ""Good Grief, Charley Brown!"" Ancestors West 31, 1-2 (2004-05): 14-15.  The Letter of Intent spells the name Charles Ditman.
<sup>3</sup> Santa Barbara County, District Court Miscellaneous Records, Affidavit of Birth, Book A, p. 247. For more information on Charles Dittman’s descendants, see Richard H. Dittman, ""Good Grief, Charley Brown!"" <i>Ancestors West</i> 31, nos. 1-2 (2004-05): 13-15.",
Hardacre1879,manuscript,"Emma C. Hardacre,","""Historical Account of the California Female Robinson Crusoe,""",Historical Account of the California Female Robinson Crusoe,Manuscript,,,,,,,,,,,,N/A,Y,,Courtesy of Marla Daily.,,,,,
Murray1878,manuscript,"E. F. Murray,","""'The Indian Woman of San Nicolas': By George Nidever,""",The Indian Woman of San Nicolas By George Nidever,"Manuscript 764,",,,4,November,1878,1878-11-04,1-4,Manuscript 764,4 Nov 1878.,"Braun Research Library Collection, Autry National Center",Los Angeles,N/A,Y,,"Manuscript Collection, Braun Research Library Collection, Autry National Center, Los Angeles; MS.764, The Indian Woman of San Nicolas by George Nidever; E. F. Murray, Santa Barbara, November 4, 1878, 6 pages","Courtesy of the Braun Research Library, Autry National Center of the American West, Los Angeles; Manuscript Collection, MS. 764.",,,,
Nidever1878,manuscript,"George Nidever,","<i>The Life and Adventures of a Pioneer of California Since 1834</i>,","The Life and Adventures of a Pioneer of California Since 1834,",Manuscript C-D133,,,,,1878,1878-01-01,1-165,Manuscript C-D133,1878,Bancroft Library,"University of California, Berkeley",N/A,Y,$144 + (not yet calculated for filmreel),,"Courtesy of The Bancroft Library, University of California, Berkeley.",,,"The memoir of George Nidever has long been considered a key source in documenting the Lone Woman’s story.  Along with Carl Dittman (also known as ""Charley Brown""), George Nidever was a central figure in the 1853 party of white men and ""Mission Indians"" (likely Chumash and/or Gabrielino men) that ultimately brought the Lone Woman to the California mainland. After the ship’s return to Santa Barbara, the Lone Woman stayed in the home of Nidever and his wife, Maria Sinforosa Ramona Sanchez de Nidever, until her death seven weeks later. Nidever, then, is an eyewitness to the Lone Woman’s habitation on San Nicolas Island, release from solitude, and life and death in Santa Barbara.

Because he was the ship owner and captain of the 1853 sea otter hunting crew, and because he later hosted the Lone Woman in his home, Nidever has generally been credited with the Lone Woman’s ""discovery"" and ""rescue.""  When the Santa Barbara chapter of the Daughters of the American Revolution erected a plaque on the site of the Lone Woman’s presumed burial at the Santa Barbara Mission, for example, it was inscribed: ""Juana Maria/ Indian woman abandoned on/ San Nicolas Island eighteen years/ found and brought to/ Santa Barbara/ by/ Capt. George Nidever/ in 1853.""  In fact, however, it was Dittman who first saw and interacted with the woman. Regardless, Nidever and Dittman’s recorded recollections of the party’s initial encounter with the Lone Woman are similar. 

In the last quarter of the nineteenth century, historian Hubert Howe Bancroft (for whom the University of California’s library is named) hired a number of research assistants to interview and take dictations from leading California figures. Both Nidever and Dittman contributed to this project by telling their life stories to Edward F. Murray in 1878, twenty-five years after the Lone Woman’s removal from San Nicolas. Nidever’s memoir was later published in a popular volume, <i>The Life and Adventures of George Nidever: The Life Story of a Remarkable California Pioneer Told in his Own Words, and None Wasted</i> (1937).

<i>The Life and Adventures of George Nidever</i> not only provides an eyewitness account of the Lone Woman’s removal, albeit at a distance of a quarter century, but also offers contemporary readers insight into the California—and United States—that the Lone Woman entered. (Nidever relates the woman’s shock upon seeing an ox-cart and horses, for example, and reports that he received an offer, which he summarily refused, to display the Lone Woman in a side show, for profit). Importantly, however, the memoir <i>also</i> helps us to see—and reflect on— how Nidever made sense of the Lone Woman. He asserted that he understood her ""plainly;"" yet, from the distance of the twenty-first century, we can see how profound barriers of language, culture, and gender separated Nidever from the island woman.

Nidever was born in eastern Tennessee in1802 and moved steadily west during his lifetime as a hunter, trapper, and rancher who also engaged in gold mining, land speculation, and occasional Indian fighting. In short, Nidever was a consummate pioneer. Born two generations after Daniel Boone, however, his landscape was California rather than Kentucky. Nidever arrived in California in 1833, having traveled from Arkansas with a party of trappers.  Once on the west coast, he decided to remain in California, which was then part of Mexico (note the name of the woman he married: Maria Sinforosa Ramona Sanchez).  When California entered the union as the thirty-first state in 1850, Nidever became an ""original"" or ""native"" Californian.

Nidever and the Lone Woman’s paths crossed because Nidever’s economic activities regularly took him to the loosely-regulated California islands: he hunted otter, collected seagull eggs, and, on San Miguel, operated a sheep ranch.  Indigenous men frequently accompanied Nidever on these money-making expeditions, and the language Nidever employed in dictating his life story gives us clues as to the hierarchy involved in these relationships. Repeatedly, Nidever omits Native people’s names and uses possessive phrases such as ""my Indian"" to describe men with whom he worked, and on occasion, considered friends. The search party for the Lone Woman is a case in point: Nidever records that Charley Brown accompanied him on the trip, and in fact saw the Lone Woman first.  But he neglects to name the ""two Indians [who] went ashore"" with them. Their identities remain unrecorded today, although the ethnographic notes of J. P. Harrington suggest some possibilities (e.g., the Chumash men Malquiares and Policarpio and the Gabrielino Nolverto). In stark contrast, early twentieth-century historians ensured the production of a memoir that secures Nidever’s name, and story, for perpetuity. In a very real sense, then, Nidever’s history rests on the erasure of Native peoples’ history.

As <i>The Life and Adventures of George Nidever</i> records, Father González of the Santa Barbara Mission requested that Nidever and his hunting party search for the Lone Woman when on San Nicolas. Nidever went to some effort and expense to do so, as the journey to the most remote of the Channel Islands was more than 120 miles roundtrip in his schooner. It was on the third trip that Nidever finally succeeded. At that time, the Lone Woman had endured eighteen years of solitude; her ""rescuers"" don’t rush her to society, however. Rather, as Nidever reports, ""we remained here hunting about a month."" Their first goal, of course, was to make the expedition profitable.

Today, Nidever is recognized as a pioneer of California and is perhaps best known as the ""discoverer"" of the Lone Woman. In all his years hunting, tracking, and trapping, one could say that she was his ""biggest catch.""",
Phelps1841,manuscript,"William Dane Phelps, ","<i>Logbook of the Alert</i>,","Logbook of the Alert,","entry for Saturday, May 29, 1841 ",,,29,May,1841,1841-05-29,,"MS AmW 84, vol. 5",,"William Dane Phelps Papers, Houghton Library, Harvard University","Houghton Library, Harvard University",N/A,Y,,"Printed by permission of the Houghton Library, Harvard University.","Printed by permission of the Houghton Library, Harvard University.",,,,
PointMuguHandout,manuscript,,"""Legend of San Nicolas Island: The Abandoned Woman of San Nicolas,""",Legend of San Nicolas Island The Abandoned Woman of San Nicolas,,,,,,1980,1980-01-01,,manuscript,,"Pacific Missile Range, Point Mugu Naval Base","Ventura County, CA","Point Mugu, California",Y,,Steve Schwartz,,,"not certain,  arbitrary based on Steve Schwartz's report that this doc was used when he began working at Point Mugu",,
Schwartz1989,manuscript,"Steve J. Schwartz,","""The Lone Woman of San Nicolas Island,""",Lone Woman of San Nicolas Island,Manuscript,,,,,1989,1989-01-01,,unpublished manuscript,,,,N/A,Y,,,Reprinted with permission of Steven J. Schwartz.,,,,
Sheridan1925,manuscript,"Edwin M. Sheridan,","""The Lost Woman of San Nicolas,""",Lost Woman of San Nicolas,Manuscript,,,,,1925,1925-01-01,1-16,manuscript,1925,"Ventura County Museum of History and Art, Ventura, CA","Ventura County, CA","Ventura, California",Y,,"""Permission granted orally and informally by Charles Johnson, archivist for Ventura County Museum. He explained that title is unclear -- owned originally (and maybe still? unclear) by Ventura County Library Agency, who deposited it and many other manuscripts with the Ventura County Museum. Likely it is in the public domain. Regardless, no one should challenge""",,,,,
Terry1882,manuscript,"James Terry,","""Reminiscences of George Nidever and Charles Brown of the Early History of Santa Barbara and the Fining [Finding] of the Woman (Indian) of San Nicolas Island,""",Reminiscences of George Nidever and Charles Brown of the Early History of Santa Barbara and the Fining [Finding] of the Woman (Indian) of San Nicolas Island,"Manuscript 770,",,,16,March,1882,1882-03-16,1-10,Manuscript 770,1882,"Braun Research Library Collection, Autry National Center",Los Angeles,N/A,Y,,"Manuscript Collection, Braun Research Library Collection, Autry National Center, Los Angeles; MS.770, Reminiscences of George Nidever and Charles Brown of the Early History of Santa Barbara and the Finding of the Woman (Indian) of San Nicolas Island, 10 pages","Courtesy of the Braun Research Library, Autry National Center of the American West, Los Angeles; Manuscript Collection, MS. 770.",,,,
MillennialStar1892,newspaper-article,,"""The Isle of Skulls,"" ",Isle of Skulls,<i>Latter-Day Saints' Millennial Star</i> (Liverpool),"54,",no. 33,15,August,1892,1892-08-15,517-18 ,,,,,"Liverpool, England, United Kingdom",Public domain,,"(N) Manchester, England",,,,,
Holder1899_TOW,newspaper-article,"Charles Frederick Holder, ","""The Wind-Swept Island of San Nicolas,"" ",Wind-Swept Island of San Nicolas,<i>Otago (NZL) Witness</i>,,no. 2388,7,December,1899,1899-12-07,55,,,,,"Dunedin, South Island, New Zealand",Public domain,,"Holder, Charles F. ","New Zealand periodicals published in this archive were found via the National Library of New Zealand’s Papers Past project: https://paperspast.natlib.govt.nz. If re-publishing, quoting from, or reproducing images from this digital archive with original publication in New Zealand, we request that you cite the original source at the National Library of New Zealand, as well as the Lone Woman and Last Indians Digital Archive (Lone Woman and Last Indians Digital Archive, University of South Carolina, https://www.nps.gov/subjects/islandofthebluedolphins/index.htm). Information about New Zealand copyright law, including fair use, can be found here: https://paperspast.natlib.govt.nz/copyright. 

Responsibility for any use of the contents of the Lone Woman and Last Indians Digital Archive rests exclusively with the user.",,,,
AlbanyEveningJournal1853,newspaper-article,"[Goliah],","""A Female Robinson Crusoe,"" ",Female Robinson Crusoe ,<i>Albany (NY) Evening Journal</i>,"24, ",no. 7172,2,November,1853,1853-11-02,2,,,,,"Albany, New York",Public domain,,,,,,,
AlbanyEveningJournal1879,newspaper-article,,"""A Feminine Crusoe. Alone on a Dreary Desert Island for Eighteen Years,""",Feminine Crusoe. Alone on a Dreary Desert Island for Eighteen Years,<i>Albany (NY) Evening Journal</i>,"49,",no. 14830,14,February,1879,1879-02-14,1,The Journal,,,,"Albany, New York",Public domain,,,,,,,
AlexandriaGazette1889,newspaper-article,,"""A Veritable Female Crusoe,"" ",Veritable Female Crusoe ,<i>Alexandria (VA) Gazette</i>,"90, ",no. 169,18,July,1889,1889-07-18,1,,,,,"Alexandria, Virginia",Public domain,,,,,,,
ArizonaWeeklyJournalMiner1893,newspaper-article,,"""An Island Transformed,"" ",Island Transformed ,<i>Arizona Weekly Journal-Miner</i>,"30, ",no. 10,19,July,1893,1893-07-19,1,,,,,"Prescott, Arizona",Public domain,,,,,,,
ArkansasCityTraveler1892,newspaper-article,,"""Wild Dogs Ate Her Child. The Story of San Nicolas Island and Its Last Inhabitant,"" ",Wild Dogs Ate Her Child. The Story of San Nicolas Island and Its Last Inhabitant,<i>Arkansas City (KS) Traveler</i>,"5, ",no. 189,7,April,1892,1892-04-07,6,,,,,"Arkansas City, Kansas",Public domain,,,,,,,
AugustaChronicle1885,newspaper-article,"[Fred Spalding Witter],","""A Feminine Crusoe. Eighteen Years on a Desert Island—How She Lived and Dressed,"" ",Feminine Crusoe. Eighteen Years on a Desert Island—How She Lived and Dressed ,<i>Augusta (GA) Chronicle</i>,,,29,May,1885,1885-05-29,6,,,,,"Augusta, Georgia",Public domain,,,,,,,
